Resultados,id,,Descripcion,Description,Enlace,Figuras,Informacion adicional
Tecnologias y modelos,tecnologiasymodelos,MARiMbA,"MARiMbA es una herramienta orientada a bibliotecas para transformar sus registros en formato MARC (MAchine-ReadableCataloging) a RDF, siguiendo las mejores prácticas de Linked Data.
La herramienta soporta todo el proceso de asignación de correspondencias transformación entre los metadatos contenidos en los registros MARC y los vocabularios elegidos para generar RDF. Es una herramienta diseñada para facilitar el proceso de generación de Linked Data y permitir que sea llevado a cabo por el personal de las bibliotecas sin necesidad de asistencia técnica. Para ello, MARiMbA ofrece las siguientes características:
-Está probada para transformar registros de autoridad y bibliográficos.
-Todo el trabajo se realiza a través de hojas de cálculo, no siendo necesario conocer el manejo de ningún lenguaje de mapeo o transformación adicional (XML, XSLT, etc.)
-La herramienta realiza un análisis previo de los registros a transformar, generando las plantillas para las correspondencias a partir de dicho análisis. Dichas plantillas están enfocadas a mejorar la toma de decisiones del usuario, la identificación de errores y la evaluación del proceso de transformación.
-Permite usar cualquier vocabulario o mezcla de vocabularios en RDFS/OWL
-Incluye un fichero de configuración que permite realizar ajustes en la transformación. En cualquier caso, viene con una configuración por defecto que sigue el modelo FRBR (Functional RequirementsforBibliographicRecords).
-Incluye un servidor SPARQL ligero (Fuseki) que permite al usuario ejecutar
La herramienta ha sido utilizada con éxito para realizar la transformación a RDF de cerca de 7 millones de registros MARC 21 de la Biblioteca Nacional de España, y que ha dado como resultado alrededor de 60 millones de tripletas RDF. Los datos transformados son accesibles a través de SPARQL en http://datos.bne.es/sparql. Por otro lado, un ejemplo de uno de los registros transformados es accesible en la siguiente dirección: http://datos.bne.es/resource/XX1718747

","MARiMbA is a tool aimed at libraries to transform their records in MARC (MAchine-ReadableCataloging) format to RDF, following the best practices of Linked Data.
The tool supports the entire transformation mapping process between the metadata contained in the MARC records and the vocabularies chosen to generate RDF. It is a tool designed to facilitate the Linked Data generation process and allow it to be carried out by library staff without the need for technical assistance. For this, MARiMbA offers the following features:
-It is proven to transform authority and bibliographic records.
-All the work is done through spreadsheets, not being necessary to know the handling of any additional mapping or transformation language (XML, XSLT, etc.)
-The tool performs a previous analysis of the records to be transformed, generating the templates for the matches from said analysis. These templates are focused on improving user decision-making, error identification and evaluation of the transformation process.
-Allows to use any vocabulary or vocabulary mix in RDFS / OWL
-Includes a configuration file that allows making adjustments to the transformation. In any case, it comes with a default configuration that follows the FRBR (Functional RequirementsforBibliographicRecords) model.
-Includes a lightweight SPARQL server (Fuseki) that allows the user to run
The tool has been used successfully to transform nearly 7 million MARC 21 records from the National Library of Spain to RDF, resulting in around 60 million RDF triples. The transformed data is accessible through SPARQL at http://datos.bne.es/sparql. On the other hand, an example of one of the transformed records is accessible at the following address: http://datos.bne.es/resource/XX1718747",,," ¿Cómo utilizarlo?
Necesitas:
-Registros MARC (autoridad y/o bibliográficos) en formato ISO 2709
-Java 1.6 o superior en el path (comprueba con java -version si no estás seguro)
-Un editor de hojas de cálculo (OpenOffice, LibreOffice, Ms Excel, etc.)
Pasos:
1 Guardar/mover los ficheros MARC a transformar en la carpeta data. Poner los bibliográficos en la carpeta data/bibliographic y los de autoridad en data/authority. Se pueden transformar tantos ficheros como se desee.
2 Ejecutar el comando que genera las plantillas de mapping: ""marimba --generatemappings -a -b""   Esta acción genera 3 hojas de cálculo: classificationMapping y annotationMapping, relationsMapping. Además, crea una hoja de cálculo adicional, alias, que permite asignar alias a aquellas clases y propiedades RDF más usadas para evitar utilizar la URI completa. Las hojas de cálculo se encuentran por defecto en la carpeta mappings.
3 Utilizando las hojas de cálculo generadas, asignar correspondencias entre las combinaciones encontradas en los registros MARC y las clases y propiedades de los vocabularios elegidos. Cada hoja de cálculo tiene una función definida:
-classificationMapping: asignar la clase o tipo de recurso RDF a generar para cada una de las combinaciones.
-annotationMapping: asignar la propiedad RDF a generar a partir de cada uno de los subcampos.
-relationsMapping: asignar la relación RDF a establecer entre los recursos encontrados que presentan una determinada variación de subcampos.
4 Guardar en la carpeta models los ficheros RDF de los vocabularios utilizados. Para ello necesitas descargarlos de la Web o exportarlos a un fichero si estabas usando un editor de ontologías (como NeOnToolkit o Protégé).
5 Ejecutar el comando que genera RDF tomando las correspondencias, los registros y los vocabularios: ""marimba --generaterdf -a -b --writeresultado.rdf""
6 Si se quieren hacer consultas SPARQL directamente sobre los datos se puede ejecutar un servidor RDF ligero (Fuseki). Para ello se debe ejecutar: ""run-marimba-server""
Y en la dirección http://localhost:3030/ se pueden hacer consultas sobre los datos generados"
Tecnologias y modelos,tecnologiasymodelos,morph,"El conjunto de tecnologías morph (junto con sus algoritmos correspondientes) se centra en aplicar una variedad de técnicas de reescritura de consultas sobre fuentes de datos federadas heterogéneas, mediante el uso de mapeos expresados ​​en el lenguaje W3C R2RML. La suite se compone de los siguientes idiomas:
- morph-RDB, para acceder a bases de datos relacionales. Actualmente brinda soporte para sistemas de administración de bases de datos relacionales como mySQL, Postgres y MonetDB. (https://oeg.fi.upm.es/index.php/es/technologies/315-morph-rdb/index.html)
- morph-LDP, una extensión de morph-RDB que funciona con nuestra implementación de Linked Data Platform [2]. (https://oeg.fi.upm.es/index.php/es/technologies/331-morph-ldp/index.html)
-morph-GFT, para acceder a Google Fusion Tables. (https://oeg.fi.upm.es/index.php/es/technologies/316-morph-gft/index.html)
-morph-streams, para acceder a los flujos de datos disponibles en Esper, GSN o SNEE, aunque extensible para otras fuentes de datos dinámicas que exponen datos a través de una API REST. (https://oeg.fi.upm.es/index.php/es/technologies/320-morph-streams/index.html)
-SPARQL-DQP, para acceder a puntos finales SPARQL federados. (https://oeg.fi.upm.es/index.php/es/technologies/166-sparql-dqp/index.html)
-kyrie, para enriquecer las consultas SPARQL considerando las implicaciones de ontologías. (https://oeg.fi.upm.es/index.php/es/technologies/314-kyrie/index.html)","The morph suite of technologies (together with their corresponding algorithms), is focused on applying a range of query rewriting techniques over heterogeneous federated data sources, through the use of mappings expressed in the W3C R2RML language. The suite is composed of the following languages:
- morph-RDB, for accessing relational databases. Currently it provides support for relational database management systems such as mySQL, Postgres and MonetDB. (https://oeg.fi.upm.es/index.php/es/technologies/315-morph-rdb/index.html)
- morph-LDP, an extension of morph-RDB that works with our Linked Data Platform implementation [2]. (https://oeg.fi.upm.es/index.php/es/technologies/331-morph-ldp/index.html)
-morph-GFT, for accessing Google Fusion Tables. (https://oeg.fi.upm.es/index.php/es/technologies/316-morph-gft/index.html)
-morph-streams, for accessing data streams available in Esper, GSN or SNEE, although extensible for other dynamic data sources that expose data through a REST API. (https://oeg.fi.upm.es/index.php/es/technologies/320-morph-streams/index.html)
-SPARQL-DQP, for accessing federated SPARQL endpoints. (https://oeg.fi.upm.es/index.php/es/technologies/166-sparql-dqp/index.html)
-kyrie, for enriching SPARQL queries by considering ontology entailments. (https://oeg.fi.upm.es/index.php/es/technologies/314-kyrie/index.html)",,,
Tecnologias y modelos,tecnologiasymodelos,morph-GFT,"morph-GFT es una extensión de morph-RDB que funciona con tablas de Google Fusion Table (GFT). Estas tablas se pueden describir mediante asignaciones R2RML y permite a los usuarios consultarlas mediante SPARQL. En morph-GFT, las consultas SPARQL planteadas por los usuarios se traducen en consultas similares a SQL que son compatibles con la API de GFT.
A diferencia de las implementaciones de bases de datos relacionales estándar que se utilizan normalmente con R2RML, la API de GFT no admite operaciones de unión. Por lo tanto, las consultas similares a SQL que se pueden evaluar directamente a través de la API de GFT son bastante simples. Por esta razón, utilizamos SPARQL-DQP [2] para realizar uniones de resultados intermedios y luego estos resultados intermedios se traducen utilizando las asignaciones R2RML especificadas por los usuarios. El uso de SPARQL-DQP aporta otro beneficio: no solo podemos unir los resultados intermedios de las tablas GFT, sino también de otros puntos finales SPARQL. [1] Aplicación de SPARQL-DQP para consultas SPARQL federadas a través de Google Fusion Tables, Freddy Priyatna, Carlos Buil Aranda, Oscar Corcho. Pista de demostración de Extended Semantic Web Conference (ESWC 2013). Enlace
[2] Semántica y optimización de la extensión de la federación SPARQL 1.1, Carlos Buil Aranda, Marcelo Arenas, Oscar Corcho. Extended Semantic Web Conference (ESWC2011), Semantic Data Management track, 2011. Premio al mejor artículo. Enlace","morph-GFT is an extension of morph-RDB that works with Google Fusion Table (GFT) tables. These tables can be described using R2RML Mappings and enables users to query them using SPARQL. In morph-GFT, SPARQL queries posed by users are translated into SQL-like queries that are supported by the GFT API.
Unlike standard relational database implementations normally used with R2RML, the GFT API does not support join operations. Therefore, the SQL-like queries that can be evaluated directly over the GFT API are rather simple. For this reason, we use SPARQL-DQP [2] to perform joins of intermediate results and then these intermediate results are translated using the R2RML mappings specified by the users. Using SPARQL-DQP brings another benefit: not only can we join the intermediate results from GFT tables, but also from other SPARQL endpoints.            [1] Applying SPARQL-DQP for Federated SPARQL Querying over Google Fusion Tables, Freddy Priyatna, Carlos Buil Aranda, Oscar Corcho. Extended Semantic Web Conference (ESWC 2013) demo track. link
[2] Semantics and optimization of the SPARQL 1.1 federation extension, Carlos Buil Aranda, Marcelo Arenas, Oscar Corcho. Extended Semantic Web Conference (ESWC2011), Semantic Data Management track, 2011. Best paper award. link",https://github.com/oeg-upm/morph-gft,https://oeg.fi.upm.es/images/architecture-morphgft.png,The morph-GFT project page is located at  https://github.com/oeg-upm/morph-gft  and the instructions of how to use morph-GFT can be found at  https://github.com/oeg-upm/morph-gft/wiki
Tecnologias y modelos,tecnologiasymodelos,morph-LDP,"morph-LDP [1] es una extensión de morph-RDB que funciona con nuestra implementación de Linked Data Platform [2]. morph-LDP expone los datos relacionales como datos vinculados de lectura / escritura para aplicaciones compatibles con LDP, al tiempo que permite que las aplicaciones heredadas continúen utilizando sus bases de datos relacionales. [1] Mihindukulasooriya, N., Priyatna F., Corcho, O., García-Castro, R. y Esteban-Gutiérrez, M. morph-LDP: implementación de una plataforma de datos enlazados basada en R2RML. La undécima sesión de demostración de la Conferencia de Web Semántica Extendida 2014, Creta, Grecia.
[2] Mihindukulasooriya, N., García-Castro, R., Esteban-Gutiérrez, M .: Linked Data Platform como un enfoque novedoso para la integración de aplicaciones empresariales. (Octubre de 2013)","morph-LDP[1] is an extension of morph-RDB that works with our Linked Data Platform implementation [2]. morph-LDP exposes relational data as read/write Linked Data for LDP-aware applications, whilst allowing legacy applications to continue using their relational databases.                                                                                                              [1] Mihindukulasooriya, N., Priyatna F., Corcho, O., García-Castro, R. and Esteban-Gutiérrez, M. morph-LDP: An R2RML-based Linked Data Platform implementation. The 11th Extended Semantic Web Conference 2014 Demo Session, Crete, Greece.
[2] Mihindukulasooriya, N., García-Castro, R., Esteban-Gutiérrez, M.: Linked Data Platform as a novel approach for Enterprise Application Integration. (Oct 2013)",https://oeg.fi.upm.es/images/stories/tecnologias/morph-ldp-scenario.png     https://oeg.fi.upm.es/images/stories/tecnologias/morph-ldp-1.png,,
Tecnologias y modelos,tecnologiasymodelos,morph-RDB,"morph-RDB [1,3] (anteriormente llamado ODEMapster) es un motor RDB2RDF desarrollado por Ontology Engineering Group, que sigue la especificación R2RML (http://www.w3.org/TR/r2rml/). morph-RDB admite dos modos operativos:
-Actualización de datos, que consiste en generar datos RDF a partir de una base de datos relacional según las descripciones del mapeo R2RML.
-Traducción de consultas, que permite evaluar consultas SPARQL sobre un conjunto de datos RDF virtual, reescribiendo esas consultas en SQL de acuerdo con las descripciones de mapeo de R2RML.
morph-RDB supera en rendimiento a herramientas similares de última generación (D2R) y algoritmos de traducción de consultas (por ejemplo, el propuesto por Chebotko y sus colegas en 2009) al emplear varios tipos de optimizaciones durante el proceso de reescritura de consultas, para generar más consultas SQL eficientes. Algunas de estas optimizaciones son la eliminación de autouniones, la eliminación de subconsultas y la eliminación de combinaciones externas izquierdas. morph-RDB ha sido probado con el benchmark sintético BSBM y se ha implementado con éxito en varios proyectos españoles / europeos (Integrate, Répener y BizkaiSense).
Por el momento, morph-RDB trabaja con sistemas de administración de bases de datos relacionales como MySQL, PostgreSQL y MonetDB. Además, morph-RDB también se ha ampliado para admitir Google Fusion Tables en un proyecto llamado morph-GFT [2] [6], y se ha integrado con nuestra implementación de Linked Data Platform (LDP) [4] [5].
El repositorio del proyecto morph-RDB se puede encontrar en https://github.com/oeg-upm/morph-rdb y las instrucciones de cómo usarlo se pueden encontrar en https://github.com/oeg-upm/morph -rdb / wiki.

[1] Freddy Priyatna, Oscar Corcho, Juan Sequeda. Formalización y experiencias de traducción de consultas de SPARQL a SQL basada en R2RML utilizando Morph. Conferencia World Wide Web (WWW 2014). Enlace
[2] Freddy Priyatna, Carlos Buil Aranda, Oscar Corcho. Aplicación de SPARQL-DQP para consultas SPARQL federadas a través de Google Fusion Tables. Pista de demostración de Extended Semantic Web Conference (ESWC 2013). Enlace
[3] Freddy Priyatna, Raúl Alonso-Calvo, Sergio Paraíso, Gueton Padrón-Sánchez y Oscar Corcho. Acceso basado en R2RML y consulta de datos clínicos relacionales con morph-RDB. Aplicaciones y herramientas web semántica para ciencias biológicas (SWAT 2015). (A aparecer)
[4] Mihindukulasooriya, N., García-Castro, R., Esteban-Gutiérrez, M .: La plataforma de datos enlazados como un enfoque novedoso para la integración de aplicaciones empresariales. (Octubre de 2013)
[5] Mihindukulasooriya, N., Priyatna F., Corcho, O., García-Castro, R. y Esteban-Gutiérrez, M. morph-LDP: implementación de una plataforma de datos enlazados basada en R2RML. Sesión de demostración de la 11ª Conferencia de Web Semántica Extendida 2014, Creta, Grecia.
[6] https://github.com/oeg-upm/morph-gft","morph-RDB [1,3] (formerly called ODEMapster) is an RDB2RDF engine developed by the Ontology Engineering Group, which follows the R2RML specification (http://www.w3.org/TR/r2rml/). morph-RDB supports two operational modes:
-Data upgrade, which consists in generating RDF data from a relational database according to the R2RML mapping descriptions.
-Query translation, which allows evaluating SPARQL queries over a virtual RDF dataset, by rewriting those queries into SQL according to the R2RML mapping descriptions.
morph-RDB outperforms similar state-of-the-art tools (D2R) and query translation algorithms (e.g., the one proposed by Chebotko and colleagues in 2009) by employing various types of optimisations during the query rewriting process, so as to generate more efficient SQL queries. Some of these optimisations are self-join elimination, subquery elimination, and left-outer join elimination. morph-RDB has been tested with the BSBM synthetic benchmark and has been successfully deployed in various Spanish/EU projects (Integrate, Répener, and BizkaiSense) .
At the moment, morph-RDB works with relational database management systems like MySQL, PostgreSQL and MonetDB. In addition, morph-RDB has also been extended to support Google Fusion Tables in a project called morph-GFT [2] [6], and has been integrated with our Linked Data Platform implementation (LDP) [4] [5].
The morph-RDB project repository can be found at https://github.com/oeg-upm/morph-rdb and the instructions of how to use it can be found at https://github.com/oeg-upm/morph-rdb/wiki.

[1] Freddy Priyatna, Oscar Corcho, Juan Sequeda. Formalisation and Experiences of R2RML-based SPARQL to SQL query translation using Morph. World Wide Web Conference (WWW 2014). link
[2] Freddy Priyatna, Carlos Buil Aranda, Oscar Corcho. Applying SPARQL-DQP for Federated SPARQL Querying over Google Fusion Tables. Extended Semantic Web Conference (ESWC 2013) demo track. link
[3] Freddy Priyatna, Raul Alonso-Calvo, Sergio Paraiso, Gueton Padron-Sanchez and Oscar Corcho. R2RML-based access and querying to relational clinical data with morph-RDB. Semantic Web Applications and Tools for Life Sciences (SWAT 2015). (To appear)
[4] Mihindukulasooriya, N., García-Castro, R., Esteban-Gutiérrez, M.: Linked Data Platform as a novel approach for Enterprise Application Integration. (Oct 2013)
[5] Mihindukulasooriya, N., Priyatna F., Corcho, O., García-Castro, R. and Esteban-Gutiérrez, M. morph-LDP: An R2RML-based Linked Data Platform implementation. The 11th Extended Semantic Web Conference 2014 Demo Session, Crete, Greece.
[6] https://github.com/oeg-upm/morph-gft",https://github.com/oeg-upm/morph-rdb,,
Tecnologias y modelos,tecnologiasymodelos,morph-streams,"morph-streams es un sistema de acceso a datos basado en ontología que permite evaluar consultas SPARQL-Stream en una variedad de sistemas de transmisión de datos, que se asignan utilizando el lenguaje W3C R2RML. Más específicamente, la versión actual de morph-streams proporciona envoltorios para:
-El motor de procesamiento de eventos complejos Esper.
-El middleware de la red de sensores GSN.
-El sistema de gestión de flujo de datos SNEE.
Las versiones anteriores de morph-streams también admitían la API de Pachube (ahora Xively), aunque ha quedado obsoleta.
Morph-streams admite dos modos de funcionamiento:
-Permite enviar consultas SPARQL-Stream directamente a una fuente de datos envuelta en R2RML. Las consultas se reescriben en el lenguaje de consulta subyacente o en la API REST y se envían al sistema subyacente, y los resultados se vuelven a traducir utilizando el mismo conjunto de asignaciones R2RML.
-Permite registrar consultas continuas SPARQL-Stream sobre una fuente de datos envuelta en R2RML, a la que los consumidores pueden suscribirse, recibiendo resultados actualizados tan pronto como son evaluados.
El repositorio del proyecto morph-streams se puede encontrar en https://github.com/oeg-upm/morph-streams, junto con instrucciones sobre cómo instalarlo y usarlo. Además, se puede encontrar una implementación en vivo de morph-streams con varios tipos de fuentes de datos de transmisión en http://streams.linkeddata.es/.","morph-streams is an ontology-based data access system that allows evaluating SPARQL-Stream queries over a range of data streaming systems, which are mapped using the W3C R2RML language. More specifically, the current version of morph-streams provides wrappers for:
-The complex event processing engine Esper.
-The sensor network middleware GSN.
-The data stream management system SNEE.
Previous versions of morph-streams also supported the API of Pachube (now Xively), although this has been deprecated.
Morph-streams supports two modes of operation:
-It allows submitting SPARQL-Stream queries directly to an R2RML-wrapped data source. Queries are rewritten into the underlying query language or REST API and submitted to the underlying system, and results are then translated back using the same set of R2RML mappings.
-It allows registering SPARQL-Stream continuous queries over an R2RML-wrapped data source, to which consumers can subscribe, receiving updated results as soon as they are evaluated.
The morph-streams project repository can be found at https://github.com/oeg-upm/morph-streams, together with instructions on how to install it and use it. Besides, a live deployment of morph-streams with several types of streaming data sources can be found at http://streams.linkeddata.es/.",https://github.com/oeg-upm/morph-streams,,"An efficient RDF processing engine for heterogeneous data streams
The purpose of this research is to design and implement an engine that allows complex queries over heterogeneous data streams in near real-time at Web scale.
There is a growing number of applications that depend on the usage of real-time spatiotemporal data, and which allow moving from the usual three levels of decision making (strategic, tactical, and operational) to real-time decision making. One example would be real-time geomarketing, where decisions on offering discount coupons to customers may be made on really short time slots based on the combination of a set of spatiotemporal data streams coming from different providers, e.g. public transport card validations or weather information. Extracting information from these streams is complex because of the heterogeneity of the data, the rate of data generation, and the volume. To tap these data sources accordingly and get relevant information, scalable processing infrastructures are required, as well as approaches to allow data integration and fusion.
Our plan is to build a distributed stream processing engine capable of adapting to changing conditions while serving complex continuous queries. First, adapters for various formats are used to convert heterogeneous streams to Linked Data streams. Then, Adaptive Query Processing (AQP) allows adjusting the query execution plan to varying conditions of the data input, the incoming queries, and the system.
Our engine will address real-time processing following the Lambda principles. Lambda is a 3-layer architecture designed to alleviate the complexities of Big Data management: a batch layer stores all the incoming data in an immutable master dataset and pre-computes batch views; a serving layer indexes views on the master dataset; and a speed layer manages the real-time processing issues and requests data views depending on incoming queries. We will follow this design together with AQP techniques and RDF compressed data structures allowing to decrease access time in large datasets, as well as data transmission time among processing nodes.

 "
