Resultados,id,,Descripcion,Description,Enlace,Figuras,Informacion adicional
Publicaciones,publicaciones,,,,http://oa.upm.es/cgi/search/advanced?screen=Public%3A%3AEPrintSearch&title_merge=ALL&title=&creators_name_merge=ALL&creators_name=&contributors_name_merge=ALL&contributors_name=&_fulltext__merge=ALL&_fulltext_=&abstract_merge=ALL&abstract=&keywords_merge=ALL&keywords=&subjects_merge=ALL&editors_name_merge=ALL&editors_name=&refereed=EITHER&publication_merge=ALL&publication=&event_title_merge=ALL&event_title=&note_merge=ALL&note=OEG&date=&satisfyall=ALL&order=-date%2Fcreators_name%2Ftitle&_action_search=Buscar,,
Ontologi­as,ontologia,,,,,,
Tecnologias y modelos,tecnologiasymodelos,CIDER-CL,"CIDER-CL es un sistema para el alineamiento monolingue y multilingüe entre ontologías. Para ello utiliza varias medidas semánticas como SoftTFIDF y Cross-Lingual Explicit Semantic Analysis. El cálculo de diferentes similitudes semánticas se combina mediante el uso de redes neuronales artificiales. CIDER-CL tiene dos modos de operar:
-Alineador de ontologías: toma dos ontologías en OWL como entrada y descubre sus equivalencias, que son ofrecidas como salida en formato RDF.
-Servicio de similitud semántica: toma dos entidades ontológicas como entrada y da el valor numérico de la similitud semática entre ellos como salida. ","CIDER-CL is a system for monolingual and multilingual alignment between ontologies. To do this, it uses various semantic measures such as SoftTFIDF and Cross-Lingual Explicit Semantic Analysis. The calculation of different semantic similarities is combined by using artificial neural networks. CIDER-CL has two modes of operation:
-Ontology aligner: takes two ontologies in OWL as input and discovers their equivalences, which are offered as output in RDF format.
-Semantic similarity service: it takes two ontological entities as input and gives the numerical value of the semantic similarity between them as output.",https://www.oeg-upm.net/files/cider-cl,,
Tecnologias y modelos,tecnologiasymodelos,geometry2rdf,geometry2rdf es una librería para generar ficheros RDF a partir de información geométrica (que puede estar disponible en GML o WKT). La manipulación del GML y WKT se realiza con GeoTools. La version actual de la librería trabaja con bases de datos geoespaciales y se basaa en Jena. geometry2rdf ha sido desarrollado por el equipo de GeoLinked Data (.es).,geometry2rdf is a library to generate RDF files from geometric information (which can be available in GML or WKT). Manipulation of GML and WKT is done with GeoTools. The current version of the library works with geospatial databases and is based on Jena. geometry2rdf has been developed by the GeoLinked Data (.es) team.,https://oeg.fi.upm.es/files/geometry2rdf/geometry2rdf_bin_0.0.3.zip,https://oeg.fi.upm.es/images/stories/tecnologias/geometry2rdf.png,"Quick start
Necesitas: Java 1.5 o superior en el path (comprueba con java -version si no estás seguro)
Que hacer:
-Descargar y extraer los archivos a un directorio de trabajo.
-La distribución actual viene con un un fichero de propiedades de ejemplo.   Este fichero puede usarse como el fichero base con el que puedes empezar a trabajar.
-Ejecuta geometry2rdf desde línea de comandos.
-Espera hasta que finalice, y comprueba el fichero rdf creado.
Trabajando con el fichero de configuración
La librería necesita un fichero de propiedades para su ejecución. El nombre por defecto del fichero es options.properties. Se proporciona un fichero de pruebas con ese nombre en la distribución para us uso. Si quieres usar un fichero diferente, cambia la ruta del fichero de propiedades en el fichero bat.                                                                                                                        Estructura del fichero de propiedades:
1. Input and output parameters: Directorio de trabajo y nombre del fichero de salida.
2. DDBB parameters: Todos los parámetros necesarios para la conexión con la BBDD se configuran en esta sección. También se configuran en esta sección el nombre del tipo de recursos que se van a crear.
3. Namespaces parameters: En esta sección se indican los namespaces y prefijos para los recursos generados y para la ontología usada.
4. Reference systems parameters: Geometry2rdf funciona para sistemas de referencia EPSG. Si tus datos gml no están en EPGS, se necesita una transformación entres tu sistema de referencia y un sistema de referencia EPSG. Para ello, utiliza los campos fields gmlSourceRS y gmlTargetRS. Si se require o se desea alguna tranformación más para los datos en el fichero RDF resultante, utilice sourceRS and targetRS.
5. Types parameters: En esta sección, se definen las URIs para los recursos Point, Linestring and Polygon. También se define la URI de la relación ""formBy"". Un recurso Linestring y Polygon están ""formBy"" Points.
6. Other parameters: En esta sección, se define el lenguaje por defecto de las etiquetas de cada recurso.                                       Ejemplos de ficheros RDF de salida.
Aquí puedes consultar unos ejemplos de ficheros RDF de salida:
-Ejemplo de un recurso de tipo Municipio con geometría formada por un único punto. https://oeg.fi.upm.es/files/geometry2rdf/Point.rdf
-Ejemplo de un recurso de tipo Balsa con una geometría de tipo Linestring. https://oeg.fi.upm.es/files/geometry2rdf/Linestring.rdf
-Ejemplo de un recurso de tipo Pozo con una geometría de tipo Polygon. https://oeg.fi.upm.es/files/geometry2rdf/Polygon.rdf"
Tecnologias y modelos,tecnologiasymodelos,gOntt,"gOntt es una herramienta para planificar y ejecutar proyectos de desarrollo cuyas principales características son las siguientes:
-Hace uso de plantillas orientadas a la planificación de desarrollos de ontologías. Estos desarrollos se basan en los escenarios propuestos por la NeOn Methodology.
-Genera las planificaciones de proyectos de desarrollo de ontologías en forma de diagramas Gantt.
-Informa a los desarrolladores de ontologías sobre cómo llevar a cabo un proceso o una actividad haciendo uso de guías metodológicas prescriptivas. También informa sobre las herramientas específicas de NeOn Toolkit que deben ser usadas.","gOntt is a tool for planning and executing development projects whose main features are the following:
-Makes use of templates oriented to the planning of ontology developments. These developments are based on the scenarios proposed by the NeOn Methodology.
-Generate the planning of ontology development projects in the form of Gantt charts.
-Informs ontology developers on how to carry out a process or an activity using prescriptive methodological guides. It also informs about the specific NeOn Toolkit tools that should be used.",http://neon-toolkit.org/wiki/Download,https://oeg.fi.upm.es/images/stories/tecnologias/gontt.png,"Funcionalidades de gOntt para la planificación de proyectos de desarrollo de ontologías.
gOntt ayuda a los desarrolladores de ontologías a decidir qué ciclo de vida es el más apropiado para construir sus ontologías (cascada o incremental-iterativo) así como qué procesos y actividades deben llevarse a cabo y en qué orden (por ejemplo, especificar los requisitos de la ontología antes de proceder a la transformar un recurso de conocimiento en una ontología). gOntt genera una representación gráfica de la planificación en forma de diagrama Gantt con los procesos y actividades requeridos, incluyendo las restricciones entre ellos. Las planificaciones de proyectos de desarrollo de ontologías pueden ser creadas desde cero (incluyendo procesos, actividades, fases y restricciones entre todos ellos) o de un modo guiado.
En el modo guiado, gOntt crea un plan preliminar para el desarrollo de la ontología en forma de:
-Plantillas que generan automáticamente la planificación inicial para proyectos de desarrollo de ontologías. Estas plantillas han sido construidas teniendo en cuenta la metodología NeOn. Las plantillas contienen un plan por defecto basado en las diferentes posibles combinaciones que se pueden dar entre modelos de ciclos de vida y procesos y actividades.
-Un simple asistente en dos pasos que contiene preguntas intuitivas que permiten al desarrollador de ontologías seleccionar el modelo de ciclo de vida de las ontologías y los procesos y actividades necesarias para su desarrollo. Para contestar a tales preguntas el desarrollador de ontologías ha de tener en cuenta los requisitos de la ontología y el tipo de recursos de conocimiento candidatos para ser reutilizados.
La principal salida de gOntt es el plan inicial para la construcción de la ontología en forma de diagrama Gantt que el desarrollador puede modificar con posterioridad ya sea: (a) incluyendo, modificando o borrando procesos, actividades y fases, (b) cambiando el orden y las dependencias entre procesos y actividades, e (c) incluyendo asignación de recursos y restricciones al plan. Esta funcionalidad de generar planes preliminares por defecto supone una gran ventaja sobre otras herramientas de planificación de proyectos.

Funcionalidades de gOntt para ayudar a la ejecución de proyectos
gOntt proporciona guías metodologías prescriptivas en forma de: (1) tarjetas que incluyen la definición de los procesos o actividades, sus objetivos, entradas, salidas, ejecutores de la acción y momento de la ejecución, y (2) un flujo de trabajo que describe cómo debe ser llevado a cabo el proceso o la actividad, así como sus entradas, salidas, tareas y actores involucrados. Además, gOntt proporciona un acceso directo y automatizado a las herramientas de NeOn Toolkit asociadas a cada proceso y actividad. Complementariamente, gOntt muestra una guía de comienzo rápido para cada herramienta lanzada.

Cómo utilizar gOntt
Para usar gOntt, en primer lugar, se debe instalar NeOn Toolkit (http://neon-toolkit.org/wiki/Download), y después, el plugin gOntt.En el siguiente enlace (http://www.neon-project.org/nw/Movie:_gOntt) se muestra un vídeo que muestra cómo usar gOntt."
Tecnologias y modelos,tecnologiasymodelos,Kyrie,"Kyrie es un sistema de reescritura de consultas que usa una ontología para reescribir una consulta Datalog en otra consulta Datalog que captura el conocimiento de la ontología. La consulta reescrita obtiene extensionalmente de la fuente de datos los resultados (certain answers) que están implicados tanto extensionalmente como intensionalmente por la consulta original. En el caso de las consultas no recursivas es posible desplegar la consulta Datalog en una unión de consultas conjuntivas, la cual puede ser posteriormente transformada a SQL u otros lenguajes, con otras herramientas como Morph.
Kyrie se inició como una derivación de REQUIEM. Los objetivos para este sistema han sido:
-mejorar los tiempos de reescritura
-producir consultas más cortas cuando sea posible, puesto que deberían suponer una carga computacional menor para los sistemas que aceptan las consultas reescritas
-mantener la lógica expresiva ELHIO para la descripción de la ontología
Estos objetivos han sido satisfechos como puede verse en la evaluación.","Kyrie is a query rewriting system that uses an ontology to rewrite a Datalog query into another Datalog query that captures knowledge of the ontology. The rewritten query gets extensionally from the data source the results (certain answers) that are both extensionally and intensionally implied by the original query. In the case of non-recursive queries, it is possible to display the Datalog query in a union of conjunctive queries, which can later be transformed to SQL or other languages, with other tools such as Morph.
Kyrie started out as an offshoot of REQUIEM. The objectives for this system have been:
-improve rewriting times
-produce shorter queries when possible, since they should put less computational load on systems that accept rewritten queries
-maintain the ELHIO expressive logic for the ontology description
These objectives have been satisfied as can be seen in the evaluation.",http://j.mp/benchmarkqueryrewriting,,"Las principales publicaciones referentes a este trabajo son las siguientes:
-Mora, José and Corcho, Oscar. ""Engineering optimisations in query rewriting for OBDA"" I-SEMANTICS, 2013, 4-6 de septiembre 2013, Graz, Austria.
-Mora, J. & Corcho, O. (2013). Towards a systematic benchmarking of ontology-based query rewriting systems. The 12th International Semantic Web Conference (ISWC2013) (p./pp. 369--384), 21-26 de octubre 2013, Sydney, Australia."
Tecnologias y modelos,tecnologiasymodelos,LabelTranslator,"LabelTranslator es un plug-in desarrollado dentro del proyecto NeOn. Este plug-in está implementado para la herramienta NeOn Toolkit y su función es la localización de los elementos , clases y propiedades, de una ontología en OWL creando un modelo repositorio lingüístico, llamado LIR por sus iniciales en inglés (Linguistic Information Repository).
El acceso multilingüe a las ontologías, hoy en día, se exige por parte de las instituciones de todo el mundo con un gran número de recursos disponibles en diferentes idiomas. Para resolver este problema, proponemos LabelTranslator, un plug-in que automáticamente localiza ontologías. LabelTranslator toma como entrada una ontología cuyas etiqueta se describen en un lenguaje natural fuente y obtiene la traducción más probable en lenguaje natural destino. En total, el plug-in soporta las siguientes funcionalidades:
-Obtiene la traducción más probable para cada etiqueta de la ontología. LabelTranslator se basa en dos módulos avanzados para esta tarea. El primer servicio, de traducción, obtiene automáticamente las diferentes traducciones posibles de una etiqueta de la ontología mediante el acceso a diferentes recursos lingüísticos. Este servicio también utiliza un método de composición con el fin de traducir las etiquetas compuestas (etiquetas formadas por varias palabras). El segundo módulo, el ranking de las traducciones, ordena las diferentes traducciones de acuerdo a la similitud con su contexto léxico y semántico. El método se basa en una medida de relación sobre la base de glosas a la ambigüedad de las traducciones. Esto se realiza mediante la comparación de los sentidos asociados a cada posible traducción y su contexto.
-Captura toda la información lingüística asociada con los conceptos utilizando un modelo lingüístico como repositorio (LIR). LIR, Repositorio de Información Lingüística, es un modelo portátil que se puede asociar a cualquiera de los términos de una ontología OWL a través de un meta-ontología OWL. Las clases principales que componen LIR (lexicalización, sentido de la definición, contexto de uso, notas y procedencia) se organizan alrededor de la clase LexicalEntry, que está vinculado a  cada término de la ontología (por medio de la relación hasLexicalEntry). El conjunto de conceptos LIR permite una completa descripción en lenguaje natural del término de la ontología al que está asociado. Además, por medio de las típicas relaciones léxicas ya sea en el mismo idioma (por ejemplo, hasSynonym) a través de idiomas (hasTranslation), LIR organiza la información lingüística en el mismo lenguaje natural y entre diferentes idiomas con el fin de proporcionar un conjunto multilingüe de información que permita la localización  de la ontología.
-Utiliza un mecanismo de sincronización para mantener la ontología y la información lingüística sincronizada. La adición de nuevos términos en la ontología o la supresión de términos existentes se controla mediante el avanzado seguimiento de cambios (basado en los recursos Delta1) utilizado en NeOn Toolkit. Este mecanismo es capaz de captar los cambios aun cuando ontológicamente hayan cambiado su posición en el modelo de la ontología. Con la adopción de esta función, LabelTranslator puede identificar con precisión el conjunto mínimo de cambios necesarios para ajustar la estructura del modelo lingüístico, un paso crítico para asegurar que un cambio importante se haga  en la ontología localizado.
Para descargar LabelTranslator, es necesario disponer de NeOn Toolkit que se puede descargar desde la página principal del proyecto NeOn Toolkit. Una vez descargada la herramienta e instalada, mediante el update site que proporciona la herramienta, podrá descargarse el plug-in LabelTranslator. La documentación de uso está disponible en la herramienta una vez descargado el plug-in e instalado.","LabelTranslator is a plug-in developed within the NeOn project. This plug-in is implemented for the NeOn Toolkit tool and its function is to locate the elements, classes and properties of an ontology in OWL creating a linguistic repository model, called LIR by its initials in English (Linguistic Information Repository).
Multilingual access to ontologies, today, is required by institutions around the world with a large number of resources available in different languages. To solve this problem, we propose LabelTranslator, a plug-in that automatically locates ontologies. LabelTranslator takes as input an ontology whose labels are described in a source natural language and obtains the most probable translation in target natural language. In total, the plug-in supports the following functionalities:
-Get the most probable translation for each ontology tag. LabelTranslator relies on two advanced modules for this task. The first service, translation, automatically obtains the different possible translations of an ontology tag by accessing different linguistic resources. This service also uses a composition method in order to translate compound tags (tags made up of multiple words). The second module, the ranking of translations, orders the different translations according to the similarity with their lexical and semantic context. The method is based on a measure of relationship based on glosses to the ambiguity of the translations. This is done by comparing the meanings associated with each possible translation and its context.
-Captures all the linguistic information associated with the concepts using a linguistic model as a repository (LIR). LIR, Linguistic Information Repository, is a portable model that can be associated with any of the terms of an OWL ontology through an OWL meta-ontology. The main classes that make up LIR (lexicalization, sense of definition, context of use, notes, and provenance) are organized around the LexicalEntry class, which is linked to each term in the ontology (through the hasLexicalEntry relation). The set of LIR concepts allows a complete description in natural language of the ontology term to which it is associated. Furthermore, by means of typical lexical relationships either in the same language (for example, hasSynonym) across languages ​​(hasTranslation), LIR organizes linguistic information in the same natural language and between different languages ​​in order to provide a set multilingual information that allows the localization of the ontology.
-Uses a synchronization mechanism to keep ontology and linguistic information synchronized. The addition of new terms in the ontology or the deletion of existing terms is controlled by the advanced change tracking (based on Delta1 resources) used in the NeOn Toolkit. This mechanism is capable of capturing changes even when ontologically they have changed their position in the ontology model. By adopting this feature, LabelTranslator can accurately identify the minimum set of changes required to adjust the structure of the linguistic model, a critical step to ensure that a major change is made to the localized ontology.
To download LabelTranslator, you need the NeOn Toolkit which can be downloaded from the main page of the NeOn Toolkit project. Once the tool has been downloaded and installed, through the update site provided by the tool, the LabelTranslator plug-in can be downloaded. The usage documentation is available in the tool once the plug-in has been downloaded and installed.",,,
Tecnologias y modelos,tecnologiasymodelos,LDP4j,"LDP4j es un framework de código abierto basado en Java para el desarrollo de aplicaciones de lectura y escritura de Linked Data basados en la especificación Linked Data Platform 1.0 (LDP) del W3C. LDP4j proporciona los componentes requeridos por los clientes y servidores para manejar sus comunicaciones basadas en LDP, ocultando la complejidad de los detalles del protocolo de los desarrolladores de aplicaciones y dejando que se centran en el desarrollo de su lógica de negocio específica para su aplicación.","LDP4j is an open source Java-based framework for developing Linked Data reading and writing applications based on the W3C's Linked Data Platform 1.0 (LDP) specification. LDP4j provides the components required by clients and servers to handle their LDP-based communications, hiding the complexity of protocol details from application developers and leaving them to focus on developing their specific business logic for their application.",http://www.ldp4j.org/,,
Tecnologias y modelos,tecnologiasymodelos,Lexical Model for ONtologies (lemon),"Lexical Model for ONtologies (lemon) es un modelo desarrollado colaborativamente en el proyecto Monnet y concebido para ser un estándar para el intercambio de información léxica en la Web Semántica. lemon se basa en trabajo anterior de miembros de Monnet como los modelos LexInfo, LIR, y LM. El modelo lemon pretende ser un modelo: conciso, descriptivo (no prescritivo), modular, y basado en RDF.","Lexical Model for ONtologies (lemon) is a model developed collaboratively in the Monnet project and conceived to be a standard for exchanging lexical information on the Semantic Web. lemon builds on previous work from Monnet members like the LexInfo, LIR, and LM models. The lemon model is intended to be a model: concise, descriptive (non-prescriptive), modular, and based on RDF.",http://lemon-model.net/,,
Tecnologias y modelos,tecnologiasymodelos,LIR - Linguistic Information Repository,,,,,
Tecnologias y modelos,tecnologiasymodelos,map4rdf,"Recientemente, hemos visto un gran incremento en la cantidad de datos geoespaciales que están publicados utilizando RDF y los principios de Linked Data. Esfuerzos como el W3C Geo XG, y más recientemente la iniciativa GeoSPARQL están proporcionando los vocabularios necesarios para publicar este tipo de información en la Web de Datos. map4rdf es un herramienta para explorar y visualizar conjuntos de datos RDF enriquecidos con información geométrica.
map4rdf es un software open source que simplemente necesita ser configurado para usar cualquier SPARQL endpoint y que proporciona a los usuarios una visualización de datos georreferenciados y en RDF en un mapa. Los aspectos geoespaciales de los datos se pueden modelar usando o el modelo de datos del W3C Geo XG o GeoSPARQL.","Recently, we have seen a large increase in the amount of geospatial data that is published using RDF and Linked Data principles. Efforts such as the W3C Geo XG, and more recently the GeoSPARQL initiative are providing the vocabularies necessary to publish this type of information on the Data Web. map4rdf is a tool for exploring and visualizing RDF data sets enriched with geometric information.
map4rdf is open source software that simply needs to be configured to use any SPARQL endpoint and that provides users with a visualization of georeferenced and RDF data on a map. The geospatial aspects of the data can be modeled using either the W3C Geo XG or GeoSPARQL data model.",http://oeg-upm.github.io/map4rdf,,https://github.com/oeg-upm/map4rdf
