Resultados,id,,Descripcion,Description,Enlace,Figuras,Informacion adicional
Tecnologias y modelos,tecnologiasymodelos,OGSA-DAI RDF Resource,"OGSA-DAI RDF Resource es una extension al sistema de acceso a datos OGSA-DAI. Esta extensión extiende OGSA-DAI añadiéndole un nuevo recurso de datos a los ya existentes en el framework (bases de datos relacionales, XML y archivos). Este nuevo recurso accede a datos en RDF almacenados en una base de datos RDF o accesibles mediante SPARQL endpoints. El acceso se realiza mediante el framework RDF Jena y Jena SDB. En la siguiente figura se muestra la extensión dentro del contexto de OGSA-DAI. Esta imagen también muestra otra extensión a OGSA-DAI, la cual accede a un sistema RDB2RDF encargado de acceder a bases de datos relacionales mediante consultas a una ontología.El nuevo recurso RDF es el encargado de configurar el acceso a los repositorios RDF. El acceso real lo realizan actividades complementarias a él. Estas actividades acceden al recurso, el cual configura los reursos de datos. Las actividades consultan posteriormente los recursos de datos y procesan los resultados de las consultas. Estos resultados son convertidos al formato interno de OGSA-DAI. Este formato son tuplas de la forma (calor1, valor2,  …) y mediante este formato es posible integrar los resultados de otras consultas a otros recursos de datos de OGSA-DAI. El código del recurso puede descargarse del SVN de OGSA-DAI. Este recurso se utilice actualmente en el proyecto ADMIRE y también es utilizado por el Sciences and Technologies Facilities Council  en el Reino Unido.","OGSA-DAI RDF Resource is an extension to the OGSA-DAI data access system. This extension extends OGSA-DAI by adding a new data resource to the existing ones in the framework (relational databases, XML and files). This new resource accesses RDF data stored in an RDF database or accessible through SPARQL terminals. Access is done through the RDF Jena and Jena SDB frameworks. The following figure shows the extension within the context of OGSA-DAI. This image also shows another extension to OGSA-DAI, which accesses an RDB2RDF system in charge of accessing relational databases through queries to an ontology. The real access is carried out by activities complementary to it. These activities access the resource, which configures the data resources. The query activities then query the data resources and process the query results. These results are converted to the internal OGSA-DAI format. This format is tuples of the form (heat1, value2,  …) and in this format it is possible to integrate the results of other queries to other OGSA-DAI data resources. The resource code can be downloaded from the OGSA-DAI SVN. This resource is currently used in the ADMIRE project and is also used by the Sciences and Technologies Facilities Council in the UK.",http://sourceforge.net/apps/trac/ogsa-dai/,https://oeg.fi.upm.es/images/stories/tecnologias/RDFResource1.png                   https://oeg.fi.upm.es/images/stories/tecnologias/RDFResource2.png,
Tecnologias y modelos,tecnologiasymodelos,OOPS!  – OntOlogy Pitfall Scanner!,"OOPS! es una aplicación web, independiente de cualquier entorno de desarrollo de ontologías, para detectar malas prácticas en ontologías que podrían, potencialmente, provocar errores en el modelado de las mismas. El objetivo de esta herramienta es ayudar a los desarrolladores de ontologías durante la actividad de validación de las mismas, la cual puede dividirse en diagnóstico y reparación. Actualmente, OOPS! proporciona mecanismos para detectar automáticamente un número de errores potenciales, ayudando por tanto a los desarrolladores durante la actividad de diagnóstico.","OOPS! is a web application, independent of any ontology development environment, to detect bad practices in ontologies that could potentially cause errors in their modeling. The objective of this tool is to help ontology developers during their validation activity, which can be divided into diagnosis and repair. Currently, OOPS! provides mechanisms to automatically detect a number of potential bugs, thereby assisting developers during diagnostic activity.",http://oops.linkeddata.es/,https://oeg.fi.upm.es/images/stories/oops-1.png    https://oeg.fi.upm.es/images/stories/oops-2.png," ¿Cómo usar OOPS!?
1)    Accede a http://oops.linkeddata.es/
2)    Introduce la URI de la ontología a analizar o pega el código RDF en el cuadro de texto correspondiente (Ver Figura 1) y haz click en el botón asociado a cada opción.
3)    Comprueba los resultados obtenidos (Ver Figura 2).
Contacto: oops@delicias.dia.fi.upm.es

 "
Tecnologias y modelos,tecnologiasymodelos,Sem4Tags,"Sem4Tags es una herramienta multilingüe capaz de descubrir el significado de una etiqueta en un contexto dado y que como resultado ofrece un recurso DBpedia que define el significado de cada etiqueta procesada. La versión actual soporta etiquetas en inglés y español.
Sem4Tags identifica el significado de etiquetas multilingües asociándoles recursos DBpedia. Este proceso tiene en cuenta el contexto de la etiqueta entendido como el conjunto de las etiquetas del usuario que coocurren cuando anotan un recurso. Sem4Tags usa un repositorio de significados multilingüe (MSR por sus siglas en inglés)  creado a partir de información de la Wikipedia, donde cada palabra se relaciona con un conjunto de posibles significados que se han extraído de las páginas de desambiguación de Wikipedia.  Para seleccionar el significado más probable para una etiqueta, Sem4Tags utiliza un modelo de vectores que tiene en cuenta los términos que aparecen en cada una de las páginas Wikipedia que definen un significado.","Sem4Tags is a multilingual tool capable of discovering the meaning of a tag in a given context and that as a result offers a DBpedia resource that defines the meaning of each processed tag. The current version supports tags in English and Spanish.
Sem4Tags identifies the meaning of multilingual tags by associating DBpedia resources with them. This process takes into account the context of the label understood as the set of user labels that occur when they annotate a resource. Sem4Tags uses a multilingual meaning repository (MSR) created from Wikipedia information, where each word is related to a set of possible meanings that have been extracted from Wikipedia's disambiguation pages. To select the most likely meaning for a tag, Sem4Tags uses a vector model that takes into account the terms that appear on each of the Wikipedia pages that define a meaning.",http://grafias.dia.fi.upm.es/Sem4Tags/,,"Existe un servicio web disponible en la siguiente dirección:http://grafias.dia.fi.upm.es/SemanticTagWebServiceRestFul/resources/tag/disambiguate
Existe una aplicación on-line disponible en la siguiente dirección:http://grafias.dia.fi.upm.es/SemanticWebApp/DisambiguationTool.xhtml"
Tecnologias y modelos,tecnologiasymodelos,sitemap4rdf,"Sitemap4rdf es una herramienta de línea de comando que genera ficheros sitemap.xml para sitios de Linked Data que tienen un SPARQL endpoint. Sitemap4rdf consulta al endpoint y recupera una lista con todas las URLs, y genera el sitemap.xml, que debe ser subido al sitio web.
Entre sus características, incluye soporte a la compresión del Sitemap, y soporte para la partición del Sitemap en varios ficheros para sitios de gran tamaño.","Sitemap4rdf is a command line tool that generates sitemap.xml files for Linked Data sites that have a SPARQL endpoint. Sitemap4rdf queries the endpoint and retrieves a list with all the URLs, and generates the sitemap.xml, which must be uploaded to the website.
Among its features, it includes support for Sitemap compression, and support for partitioning the Sitemap into several files for large sites.",http://lab.linkeddata.deri.ie/2010/sitemap4rdf/,,
Tecnologias y modelos,tecnologiasymodelos,SPARQL-DQP,"Este sistema implementa la extensión para la federación de consultas de SPARQL 1.1, extendiendo el sistema OGSA-DAI/DQP. Además, optimiza la ejecución de las consultas, trabajo realizado por SPARQL-DQP. Para ello, primero se identifican una serie de patrones bien diseñados (descritos en [1] and [2]) y si dichos patrones son identificados el sistema utiliza una serie de reglas de escritura que mejoran el tiempo de ejecución de las consultas.

[1] J. Pérez, M. Arenas and C. Gutierrez, Semantics and complexity of SPARQL, TODS 34(3), 2009
[2] Semantics and optimization of the SPARQL 1.1 federation extension, Carlos Buil Aranda, Marcelo Arenas, Oscar Corcho. Extended Semantic Web Conference (ESWC2011), Semantic Data Management track, 2011. Best paper award. https://oeg.fi.upm.es/files/pdf/eswc11paper.pdf.
[3] Federating Queries in SPARQL1.1:Syntax, Semantics and Evaluation, Carlos Buil-Aranda, Marcelo Arenas, Oscar Corcho, Axel Polleres.http://www.websemanticsjournal.org/index.php/ps/article/view/321. ","This system implements the SPARQL 1.1 query federation extension, extending the OGSA-DAI / DQP system. In addition, it optimizes the execution of the queries, work carried out by SPARQL-DQP. To do this, first a series of well-designed patterns are identified (described in [1] and [2]) and if these patterns are identified, the system uses a series of writing rules that improve the execution time of the queries.
[1] J. Pérez, M. Arenas and C. Gutierrez, Semantics and complexity of SPARQL, TODS 34 (3), 2009
[2] Semantics and optimization of the SPARQL 1.1 federation extension, Carlos Buil Aranda, Marcelo Arenas, Oscar Corcho. Extended Semantic Web Conference (ESWC2011), Semantic Data Management track, 2011. Best paper award. https://oeg.fi.upm.es/files/pdf/eswc11paper.pdf.
[3] Federating Queries in SPARQL1.1: Syntax, Semantics and Evaluation, Carlos Buil-Aranda, Marcelo Arenas, Oscar Corcho, Axel Polleres.http: //www.websemanticsjournal.org/index.php/ps/article/view/ 321.",http://videolectures.net/eswc2011_corcho_extension/,,
Tecnologias y modelos,tecnologiasymodelos,vocab-express,"Hasta ahora, los principios y buenas prácticas de Linked Data están siendo adoptadas por un número creciente de proveedores de datos, teniendo como resultado una base de datos global en la Web que contiene cientos de conjuntos de datos LOD. En este contexto es importante promover la re-utilización y enlazado de conjuntos de datos, y para este fin, es necesario conocer la estructura de los conjuntos de datos. Un primer paso para conocer la estructura de un conjunto de datos es explorar el vocabulario utilizado por el conjunto de datos, y como el conjunto de datos está utilizando ese vocabulario.
vocab-express es una herramienta simple para explorar el vocabulario utilizado en un conjunto de datos dado. La herramienta provee toda la información relacionada del vocabulario:
1 la lista de todas las clases
2 la lista de todas las properties
3 el número de instancias de cada clase
4 el número de instancias de cada property
5 el lenguaje de las etiquetas y comentarios de los elementos del vocabulario.
vocab-express está siendo implementado en node.js, que es una plataforma construida sobre V8 (Google's open source JavaScript engine) para construir aplicaciones de red rápidas y escalables. La figura muestra el flujo de información de vocab-express.","So far, Linked Data principles and good practices are being adopted by a growing number of data providers, resulting in a global database on the Web containing hundreds of LOD data sets. In this context, it is important to promote the reuse and linking of data sets, and for this purpose, it is necessary to know the structure of the data sets. A first step in understanding the structure of a data set is to explore the vocabulary used by the data set, and how the data set is using that vocabulary.
vocab-express is a simple tool for exploring the vocabulary used in a given data set. The tool provides all the related vocabulary information:
1 the list of all classes
2 the list of all properties
3 the number of instances of each class
4 the number of instances of each property
5 the language of the labels and comments of the vocabulary elements.
vocab-express is being implemented in node.js, which is a platform built on V8 (Google's open source JavaScript engine) to build fast and scalable network applications. The figure shows the information flow of vocab-express.",,https://oeg.fi.upm.es/images/stories/tecnologias/vocab-express.jpg,
Tecnologias y modelos,tecnologiasymodelos,NOR2O,"NOR2O ya no está siendo utilizado, ni es mantenido por el grupo.

NOR2O es una librería para la transformación de recursos no ontológicos en ontologías. Los recursos no-ontológicos (NOR) son recursos de conocimiento cuya semántica no ha sido todavía formalizada en una ontología. Hay una gran cantidad de NORs que incorporan conocimientos sobre algunos dominios particulares y que representan algún grado de consenso.
En el contexto de la Metodología NeOn, proponemos un método general para la re-ingeniería de recursos no-ontológicos en ontologías. Se basa en  un patrón de re-ingeniería que define un procedimiento para transformar los componentes de un recurso no-ontológico en primitivas de una ontología, utilizando WordNet para desambiguar las relaciones implícitas de los componentes del NOR.
La figura 1 muestra el diagrama de arquitectura de alto nivel conceptual de los módulos implicados. El NOR connector carga los esquemas de clasificación, tesauros y lexicones con sus correspondientes modelos de datos e implementados en bases de datos, XML, ficheros de texto plano y hojas de cálculo..
El Transformer lleva a cabo la transformación propuesta por los patrones. Este módulo interactúa con el módulo Semantic Relation Disambiguator para obtener la semántica de las relaciones de los elementos NOR.
El Semantic Relation Disambiguator se encarga de obtener la semántica de las relaciones entre dos elementos NOR. Básicamente, el módulo recibe dos elementos NOR del módulo Transformer y devuelve la semántica entre ellos. El módulo conecta el recurso externo a través del módulo External Resource Service para obtener la relación.
El External Resource Service  se encarga de interactuar con los recursos externos para obtener la semántica de las relaciones entre elementos NOR. Actualmente el módulo interactúa con WordNet. Estamos implementando el acceso a DBpedia.
El OR Connector  genera la ontología en OWL Lite. Para ello, utiliza la OWL API. Finalmente, para concluir la descripción de la librería de software, conviene mencionar que la implementación de esta libraría sigue un enfoque modular, por lo tanto, es posible extenderla para incluir otros tipos de NOR, modelos de datos e implementaciones de una manera sencilla, así como la explotación de otros recursos externos para la desambiguación de relaciones.","NOR2O is no longer being used, nor is it maintained by the group.

NOR2O is a library for transforming non-ontological resources into ontologies. Non-ontological resources (NOR) are knowledge resources whose semantics have not yet been formalized in an ontology. There are a large number of NORs that incorporate knowledge about some particular domains and that represent some degree of consensus.
In the context of the NeOn Methodology, we propose a general method for the re-engineering of non-ontological resources in ontologies. It is based on a re-engineering pattern that defines a procedure to transform the components of a non-ontological resource into primitives of an ontology, using WordNet to disambiguate the implicit relationships of the NOR components.
Figure 1 shows the conceptual high-level architecture diagram of the modules involved. The NOR connector loads the classification schemes, thesauri and lexicons with their corresponding data models and implemented in databases, XML, plain text files and spreadsheets.
The Transformer carries out the transformation proposed by the patterns. This module interacts with the Semantic Relation Disambiguator module to obtain the semantics of the relationships of the NOR elements.
The Semantic Relation Disambiguator is responsible for obtaining the semantics of the relationships between two NOR elements. Basically the module receives two NOR elements from the Transformer module and returns the semantics between them. The module connects the external resource through the External Resource Service module to get the relationship.
The External Resource Service is responsible for interacting with external resources to obtain the semantics of the relationships between NOR elements. Currently the module interacts with WordNet. We are implementing access to DBpedia.
The OR Connector generates the ontology in OWL Lite. To do this, it uses the OWL API. Finally, to conclude the description of the software library, it should be mentioned that the implementation of this library follows a modular approach, therefore, it is possible to extend it to include other types of NOR, data models and implementations in a simple way, as well as the exploitation of other external resources for the disambiguation of relationships.",,https://oeg.fi.upm.es/images/stories/tecnologias/nor2o.png,
Tecnologias y modelos,tecnologiasymodelos,ODESeW,"ODESeW ya no está siendo utilizado ni mantenido por nuestro grupo.

ODESeW (Semantic Web Portal based on WebODE platform) es una aplicación basada en ontologías que genera automáticamente y gestiona portales de conocimiento para intranets y extranets. ODESeW está construido dentro de la plataforma de ingeniería de ontologías WebODE y provee las siguientes funcionalidades:
-Modela conocimiento mediante una plataforma de desarrollo de ontologías que entregra un conjunto de servicios de desarrollo de ontologías. Así como el portal de conocimiento se va a usar en la web, es altamente recomendado que use un servidor de ontologías (y no un editor de ontologías ejecutado de forma aislada) que permita construir ontologías de forma colaborativa así como dar acceso a los ontologías mediante internet. La construcción del portal sobre un servidor de ontologías facilita la sincronización de la información acorde a los cambios de las ontologías. Desde una perspectiva software, el portal se beneficia de los servicios presentes y futuros del servidor de ontologías.
-Edición e inserción de contenido mediante edición de instancias de ontologías. ODESeW permite insertar, actualizar y borrar instancias de clases, sus atributos y sus relaciones en una red de ontologías interrelacionadas y con diferentes permisos de edición para los usuarios del portal. Como parte de la edición de instancias, ODESeW puede ser utilizado como una herramienta de gestión documentacional en la que permite manejar documentos electrónicos.
-Visualización de contenido mediante visualizaciones para los usuarios de ontologías, relaciones e instancias altamente configurables. La ontologías es utilizada como índice de la información insertada y para navegar atreves de esta. El contenido almacenado en el portal puede ser accedido dinámicamente mediante minués generados por las ontologías acorde a los permisos del usuario, visualizando así las distintos tipos de información introducidos en el portal. El portal de conocimientos también provee anotación de su contenido en RDF(S), , DAML+OIL y OWL.
-Búsqueda y consultas del contenido basada en una aproximación híbrida entre ontologías y búsqueda por palabras. El modulo de búsquedas y consultas utiliza al interfaz de acceso de WebODE para acceder y consultar contenido de las ontologías.
-Servicios que facilitan la administración, que permiten gestionar los usuarios del portal, los permisos de edición y visualización, otros elementos de gestión del portal. Estos servicios puede ser solamente accedidos por aquellos usuarios que pertenecen al grupo de administración del portal.
-Como una ventaja importante de ODESeW frente a otros portales de conocimiento similares es la automática sincronización del portal y de las ontologías en las que se basa. Así, si una ontología es modificada dentro del editor de ontologías WebODE, los cambios se ven automáticamente reflejados en el portal, tanto como la conceptualización misma de la ontologías como de sus instancias.","ODESeW is no longer being used or maintained by our group.

ODESeW (Semantic Web Portal based on WebODE platform) is an ontology-based application that automatically generates and manages knowledge portals for intranets and extranets. ODESeW is built within the WebODE ontology engineering platform and provides the following functionalities:
-Models knowledge through an ontology development platform that delivers a set of ontology development services. Just as the knowledge portal will be used on the web, it is highly recommended that you use an ontology server (and not an ontology editor executed in isolation) that allows you to build ontologies in a collaborative way as well as give access to the ontologies through Internet. The construction of the portal on an ontology server facilitates the synchronization of the information according to the changes of the ontologies. From a software perspective, the portal benefits from the present and future services of the ontology server.
-Editing and inserting content by editing instances of ontologies. ODESeW allows inserting, updating and deleting class instances, their attributes and their relationships in a network of interrelated ontologies and with different editing permissions for portal users. As part of the edition of instances, ODESeW can be used as a document management tool in which it allows to manage electronic documents.
-Visualization of content through visualizations for users of highly configurable ontologies, relationships and instances. The ontologies is used as an index of the inserted information and to navigate through it. The content stored in the portal can be accessed dynamically through minutes generated by the ontologies according to the user's permissions, thus visualizing the different types of information entered in the portal. The knowledge portal also provides annotation of your content in RDF (S),, DAML + OIL and OWL.
-Search and content queries based on a hybrid approach between ontologies and word search. The search and query module uses the WebODE access interface to access and consult content from the ontologies.
-Services that facilitate administration, that allow managing portal users, editing and viewing permissions, other portal management elements. These services can only be accessed by those users who belong to the portal's administration group.
-As an important advantage of ODESeW compared to other similar knowledge portals is the automatic synchronization of the portal and the ontologies on which it is based. Thus, if an ontology is modified within the WebODE ontology editor, the changes are automatically reflected in the portal, as well as the very conceptualization of the ontologies and their instances.",,,
Tecnologias y modelos,tecnologiasymodelos,OWLDoc,"OWLDoc es un plug-in desarrollado dentro del proyecto NeOn. Este plug-in está implementado para la herramiento NeOn Toolkit y su función es añadir una opción al menú de exportación de la herramienta para generar documentos HTML a partir de una ontology OWL.
El plug-in utiliza el OWL API para extrar la información de la ontología OWL y crear una salida que contiene, de manera organizada, un conjunto de ficheros HTML que proporcionan la documentación acerca de la ontología y todos sus recursos.
Para descargar OWLDoc, es necesario disponer de NeOn Toolkit que se puede descargar desde la página principal del proyecto NeOn Toolkit. Una vez descargada la herramienta e instalada, mediante el update site que proporciona la herramienta, podrá descargarse el plug-in OWLDoc. La documentación de uso está disponible en la herramienta una vez descargado el plug-in e instalado.","OWLDoc is a plug-in developed within the NeOn project. This plug-in is implemented for the NeOn Toolkit tool and its function is to add an option to the tool's export menu to generate HTML documents from an OWL ontology.
The plug-in uses the OWL API to extract the information from the OWL ontology and create an output that contains, in an organized way, a set of HTML files that provide documentation about the ontology and all its resources.
To download OWLDoc, you need the NeOn Toolkit which can be downloaded from the NeOn Toolkit project home page. Once the tool has been downloaded and installed, through the update site provided by the tool, the OWLDoc plug-in can be downloaded. The usage documentation is available in the tool once the plug-in has been downloaded and installed.",,,
